IP address,remote ssh version,country_code2,organization,asn
192.42.116.219,SSH-2.0-OpenSSH_9.9,NL,SURF B.V.,
201.186.40.250,SSH-2.0-libssh_0.9.6,CL,Telefonica del Sur S.A.,
85.192.56.68,SSH-2.0-Go,RU,Aeza Group Ltd.,
123.59.135.110,SSH-2.0-libssh_0.9.6,CN,"IDC, China Telecommunications Corporation",
116.122.138.193,SSH-2.0-libssh_0.9.6,KR,SK Broadband Co Ltd,
59.63.211.229,SSH-2.0-libssh_0.9.6,CN,CHINANET Jiangx province IDC network,
101.126.95.220,SSH-2.0-libssh_0.9.6,CN,"Beijing Volcano Engine Technology Co., Ltd.",
198.235.24.102,,US,Google LLC,
8.222.180.151,SSH-2.0-libssh_0.9.6,SG,"Alibaba (US) Technology Co., Ltd.",
178.128.153.137,SSH-2.0-libssh_0.9.6,US,"DigitalOcean, LLC",
182.72.16.162,SSH-2.0-libssh_0.9.6,IN,Bharti Airtel Limited,
147.185.132.91,SSH-2.0-ZGrab ZGrab SSH Survey,US,Google LLC,
75.72.197.45,SSH-2.0-OpenSSH_9.2p1 Debian-2+deb12u2,US,"Comcast Cable Communications, LLC",
128.199.188.253,SSH-2.0-libssh_0.9.6,SG,"DigitalOcean, LLC",
198.235.24.18,SSH-2.0-ZGrab ZGrab SSH Survey,US,Google LLC,
