IP address,remote ssh version,country_code2,organization,asn
124.156.205.101,SSH-2.0-libssh_0.9.6,SG,Shenzhen Tencent Computer Systems Company Limited,
8.222.137.9,SSH-2.0-libssh_0.9.6,SG,"Alibaba (US) Technology Co., Ltd.",
165.232.86.205,,NL,"DigitalOcean, LLC",
104.40.85.15,MGLNDD_15.188.246.148_22,US,Microsoft Corporation,
171.220.244.134,SSH-2.0-libssh_0.9.6,CN,CHINANET SiChuan Telecom Internet Data Center,
218.55.114.90,SSH-2.0-libssh_0.9.6,KR,SK Broadband Co Ltd,
85.192.56.68,SSH-2.0-Go,RU,Aeza Group Ltd.,
92.255.85.107,SSH-2.0-Go,RU,Chang Way Technologies Co. Limited,
